{
  "$schema": "https://json-schema.org/draft/2020-12/schema",
  "$id": "https://ai-silicon-lab.invalid/schema/run-record.schema.json",
  "title": "AI Silicon Lab experiment run record",
  "type": "object",
  "required": [
    "schema_version",
    "record_type",
    "run_id",
    "experiment_id",
    "experiment_revision",
    "status",
    "measurement_status",
    "agent",
    "usage",
    "time",
    "cost",
    "execution",
    "result",
    "evidence"
  ],
  "properties": {
    "schema_version": { "const": 1 },
    "record_type": { "const": "experiment-run" },
    "run_id": { "type": "string", "minLength": 1 },
    "experiment_id": { "type": "string", "pattern": "^[a-z0-9]+(?:-[a-z0-9]+)*$" },
    "experiment_revision": { "type": ["integer", "string"], "pattern": "\\S" },
    "status": { "enum": ["draft", "running", "pass", "fail", "blocked", "reported"] },
    "measurement_status": { "$ref": "#/$defs/source" },
    "agent": {
      "type": "object",
      "required": ["model", "harness", "reasoning"],
      "properties": {
        "model": { "$ref": "#/$defs/model" },
        "harness": { "type": "object" },
        "reasoning": { "type": "object" }
      }
    },
    "usage": { "$ref": "#/$defs/usage" },
    "time": { "$ref": "#/$defs/measurement" },
    "cost": { "$ref": "#/$defs/measurement" },
    "execution": { "type": "object" },
    "result": { "type": "object" },
    "evidence": { "type": "array", "items": { "$ref": "#/$defs/evidence" } }
  },
  "additionalProperties": true,
  "$defs": {
    "evidence": {
      "type": "object",
      "required": ["kind", "description"],
      "properties": {
        "kind": { "type": "string", "pattern": "\\S" },
        "description": { "type": "string", "pattern": "\\S" },
        "path": { "type": ["string", "null"], "pattern": "\\S" },
        "sha256": { "type": ["string", "null"], "pattern": "^[0-9a-fA-F]{64}$" }
      },
      "if": { "required": ["sha256"], "properties": { "sha256": { "type": "string" } } },
      "then": { "required": ["path"], "properties": { "path": { "type": "string", "pattern": "\\S" } } }
    },
    "source": { "enum": ["measured", "reported", "estimated", "mixed", "unavailable"] },
    "nullableNumber": { "type": ["number", "null"], "minimum": 0 },
    "nullableTokens": { "type": ["integer", "null"], "minimum": 0 },
    "model": {
      "type": "object",
      "required": ["identity_status", "canonical_id"],
      "properties": {
        "provider": { "type": ["string", "null"] },
        "display_name": { "type": ["string", "null"] },
        "canonical_id": { "type": ["string", "null"] },
        "identity_status": { "enum": ["exact", "alias-only", "unknown"] }
      },
      "allOf": [
        {
          "if": { "properties": { "identity_status": { "const": "exact" } } },
          "then": { "properties": { "canonical_id": { "type": "string", "pattern": "\\S" } } },
          "else": { "properties": { "canonical_id": { "type": "null" } } }
        },
        {
          "if": { "properties": { "identity_status": { "const": "alias-only" } } },
          "then": {
            "required": ["display_name"],
            "properties": { "display_name": { "type": "string", "pattern": "\\S" } }
          }
        }
      ]
    },
    "sourceSection": {
      "type": "object",
      "required": ["source"],
      "properties": { "source": { "$ref": "#/$defs/source" } },
      "if": { "properties": { "source": { "const": "unavailable" } } },
      "then": {
        "required": ["notes"],
        "properties": { "notes": { "type": "string", "pattern": "\\S" } }
      }
    },
    "usage": {
      "allOf": [{ "$ref": "#/$defs/sourceSection" }],
      "required": ["input_tokens", "cached_input_tokens", "cache_write_tokens", "output_tokens", "reasoning_tokens", "total_tokens"],
      "properties": {
        "input_tokens": { "$ref": "#/$defs/nullableTokens" },
        "cached_input_tokens": { "$ref": "#/$defs/nullableTokens" },
        "cache_write_tokens": { "$ref": "#/$defs/nullableTokens" },
        "output_tokens": { "$ref": "#/$defs/nullableTokens" },
        "reasoning_tokens": { "$ref": "#/$defs/nullableTokens" },
        "total_tokens": { "$ref": "#/$defs/nullableTokens" }
      },
      "if": { "properties": { "source": { "const": "unavailable" } } },
      "then": {
        "properties": {
          "input_tokens": { "type": "null" },
          "cached_input_tokens": { "type": "null" },
          "cache_write_tokens": { "type": "null" },
          "output_tokens": { "type": "null" },
          "reasoning_tokens": { "type": "null" },
          "total_tokens": { "type": "null" }
        }
      }
    },
    "measurement": {
      "allOf": [{ "$ref": "#/$defs/sourceSection" }],
      "patternProperties": { "(_seconds|_hours)$|^amount$": { "$ref": "#/$defs/nullableNumber" } },
      "if": { "properties": { "source": { "const": "unavailable" } } },
      "then": {
        "patternProperties": { "(_seconds|_hours)$|^amount$": { "type": "null" } }
      }
    }
  }
}
