{
  "schema_version": 1,
  "record_type": "experiment-run",
  "run_id": "doom-orangecrab-10772a4-simulation-regression",
  "experiment_id": "doom-rv32imc",
  "experiment_revision": 1,
  "status": "pass",
  "measurement_status": "measured",
  "agent": {
    "model": {
      "provider": "OpenAI",
      "display_name": "Codex (GPT-5)",
      "canonical_id": null,
      "identity_status": "unknown"
    },
    "harness": {
      "name": "Codex",
      "version": null,
      "environment": "desktop"
    },
    "reasoning": {
      "effort": null,
      "mode": null,
      "context": "active persistent goal"
    },
    "goal_sha256": "bd8d246d689e25908acc486c71758230e895862a4a81b21a07ff07bd049fab55",
    "instruction_hashes": [
      {"path": "AGENTS.md", "sha256": "55a0c86976b675178801e1169510eec0df6e9a2c8efcaaeebe05825833e33a20"},
      {"path": "LAB.md", "sha256": "fcd603a72aa95af898026936aab57398c11c86e677dcdf319eafa480456cdb0c"},
      {"path": "EVALUATION.md", "sha256": "9049e654471f6e5ceec01cc4dfdebef46f16a440f807e58c9ba81b9d5f1eaad5"},
      {"path": "experiments/doom-rv32imc/experiment.json", "sha256": "b4ce52ae5fd1bf7635f98f452dd697e5a39892f0a66c9f1c5acebc756bf05523"},
      {"path": "experiments/doom-rv32imc/PLAN.md", "sha256": "8639a862137e68e30c1aba1397a0b5e1a1fae3fa58319812f78eb082bad9cf39"}
    ],
    "subagents": [],
    "attribution_source": "direct Codex goal telemetry and repository state"
  },
  "usage": {
    "input_tokens": null,
    "cached_input_tokens": null,
    "cache_write_tokens": null,
    "output_tokens": null,
    "reasoning_tokens": null,
    "total_tokens": 1170260,
    "source": "measured",
    "precision": "exact telemetry snapshot",
    "notes": "Active-goal total at 2026-08-30T08:29:08Z; category fields were not exposed."
  },
  "time": {
    "started_at": "2026-08-30T08:09:07.352428Z",
    "finished_at": "2026-08-30T08:29:08Z",
    "agent_wall_seconds": 6388,
    "human_seconds": null,
    "build_seconds": 71.929893,
    "simulation_seconds": 2337.6861149180417,
    "hardware_seconds": null,
    "source": "mixed",
    "notes": "Agent time is the exposed active-goal total. Build time sums the authoritative and detached builds. Simulation time sums the authoritative run, detached reproduction, and four concurrently executed strengthened workloads; it is compute time, not elapsed wall time. No physical execution occurred."
  },
  "cost": {
    "amount": null,
    "currency": "USD",
    "source": "unavailable",
    "rate_date": null,
    "notes": "No billing telemetry or pinned rate source was exposed."
  },
  "execution": {
    "candidate_commit": "10772a4eebe168956967a850a39503c7993280f1",
    "candidate_tree": "385f811509dd3a4a0c3339a86cb680f40c39d7ba",
    "main_base": "b9beb9f5a97c6706ccb04c33f017134c3d283c0b",
    "candidate_manifest": "workspace/candidate.json",
    "harness_run_ids": ["simulation-complete-orangecrab-final", "20260830T081352Z-83a68ebe"],
    "lab_run_ids": ["simulation-complete-orangecrab-final"],
    "benchmark_id": "freedoom-phase1-headless-v1-plus-strengthened-exact-oracles",
    "tool_versions": {
      "verilator": "5.050",
      "yosys": "0.68+post c12172fbae8af5e20f6fb52e3d4e92d56ed587b6"
    },
    "artifact_paths": [
      "runs/simulation-complete-orangecrab-final/metrics.json",
      ".aisl/reproduce/simulation-complete-orangecrab-final/runs/20260830T081352Z-83a68ebe/metrics.json",
      ".aisl/verification/rtl-suite-orangecrab-final/suite-result.json",
      "workspace/physical/orangecrab/evidence/10772a4/final-simulation-regression.json"
    ],
    "commands": [
      "./lab/evaluate --run-id simulation-complete-orangecrab-final",
      "./lab/reproduce simulation-complete-orangecrab-final",
      "python3 workspace/verification/run_rtl_suite.py .aisl/verification/rtl-suite-orangecrab-final --jobs 4"
    ]
  },
  "result": {
    "status": "simulation-complete-reproduced-after-hardware-integration",
    "claim_level": "authoritative-cycle-accurate-rtl-exact-oracle",
    "authoritative_frames_expected": 120,
    "authoritative_frames_received": 120,
    "authoritative_mismatches": 0,
    "authoritative_cycles": 744664922,
    "authoritative_retired_instructions": 581003386,
    "detached_reproduction_pass": true,
    "detached_reproduction_cycles": 744664922,
    "strengthened_frames_expected": 736,
    "strengthened_frames_received": 736,
    "strengthened_mismatches": 0,
    "strengthened_cycles": 3736255182,
    "simulation_complete": true,
    "physical_execution_complete": false,
    "overall_experiment_complete": false,
    "notes": "The simulation-complete milestone remains reproducible after OrangeCrab integration. Overall completion is not claimed because no physical target was available; see the separate blocked physical run record."
  },
  "evidence": [
    {
      "kind": "authoritative-evaluator",
      "path": "runs/simulation-complete-orangecrab-final/metrics.json",
      "sha256": "2504611af36ad01803a9493f731c4afdc788f24310aa1430fc5a5784072c15cf",
      "description": "Protected evaluator pass with 120/120 exact frames and intact trust roots."
    },
    {
      "kind": "detached-reproduction",
      "path": ".aisl/reproduce/simulation-complete-orangecrab-final/runs/20260830T081352Z-83a68ebe/metrics.json",
      "sha256": "2fdfb6f83cc711738796d16dc157ee95f216f8df54b54a359bbeb2e972260a49",
      "description": "Independent clean linked-worktree rebuild and exact rerun of the candidate commit."
    },
    {
      "kind": "strengthened-exact-oracles",
      "path": ".aisl/verification/rtl-suite-orangecrab-final/suite-result.json",
      "sha256": "32c1cceaecb1a857c0ea6bc9b6434fb0e617acba79e352ac28435487284806b8",
      "description": "Four deterministic workloads with 736/736 exact frame comparisons and trace hashes."
    },
    {
      "kind": "committed-summary",
      "path": "workspace/physical/orangecrab/evidence/10772a4/final-simulation-regression.json",
      "sha256": "31085029c3e61cf1aca45aed2e80cc80340e974da6d74b85be34b9c1fc1b7cce",
      "description": "Content-addressed summary of the evaluator, detached reproduction, and strengthened suite."
    }
  ]
}
